{
  "sampleMetadata": {
    "syntheticSample": true,
    "profileId": "RD24001-IMO-FAL-UNCEFACT-JSON-SAMPLE-1.0",
    "imoCompendiumVersion": "FAL.5/Circ.56",
    "datasetCode": "MAIL",
    "datasetName": "Delivery Bill for Mail Consignment",
    "datasetSlug": "delivery-bill-mail-consignment",
    "note": "Synthetic demonstration payload; not an official IMO normative JSON message."
  },
  "messageHeader": {
    "messageFunctionCode": {
      "content": "9",
      "listId": "1225",
      "listAgencyId": "UN/EDIFACT"
    },
    "authenticationDateTime": {
      "content": "2026-09-29T00:00:00Z"
    },
    "messageId": {
      "content": "MAIL-9300049-04",
      "schemeId": "RD24001-SAMPLE"
    }
  },
  "ship": {
    "imoShipNumberId": {
      "content": "9300049",
      "schemeId": "IMOShipNumber",
      "schemeAgencyId": "IMO"
    },
    "shipName": "RD PACIFIC STAR",
    "callSignId": {
      "content": "DR0004"
    },
    "mmsiNumberId": {
      "content": "440000004",
      "schemeId": "MMSI"
    },
    "flagStateId": {
      "content": "JP",
      "schemeId": "ISO3166-1-alpha2"
    },
    "shipTypeCode": {
      "content": "60",
      "listId": "UNECE-Rec28"
    },
    "shipTypeName": "Passenger ship"
  },
  "voyage": {
    "voyageId": {
      "content": "RD26-004"
    },
    "portOfDepartureCode": {
      "content": "KRPUS",
      "listId": "UNLOCODE"
    },
    "portOfDepartureName": "Busan, Republic of Korea",
    "portOfArrivalCode": {
      "content": "JPTYO",
      "listId": "UNLOCODE"
    },
    "portOfArrivalName": "Tokyo, Japan",
    "estimatedArrivalDateTime": {
      "content": "2026-09-29T00:00:00Z"
    },
    "estimatedDepartureDateTime": {
      "content": "2026-09-29T14:00:00Z"
    },
    "nextPortCode": {
      "content": "CNSHA",
      "listId": "UNLOCODE"
    },
    "nextPortName": "Shanghai, China"
  },
  "imoDataReferences": {
    "messageHeader.messageFunctionCode": "IMO0305",
    "messageHeader.arrivalDepartureCode": "IMO0013",
    "messageHeader.authenticationDateTime": "IMO0014",
    "ship.imoShipNumberId": "IMO0140",
    "ship.shipName": "IMO0142",
    "ship.callSignId": "IMO0136",
    "ship.mmsiNumberId": "IMO0326",
    "ship.flagStateId": "IMO0138",
    "voyage.portOfArrivalCode": "IMO0108",
    "voyage.portOfArrivalName": "IMO0109",
    "voyage.estimatedArrivalDateTime": "IMO0064",
    "messageHeader.messageId": "IMO0277",
    "mailDeliveryBill.originOfficeId": "IMO1232",
    "mailDeliveryBill.originOfficeName": "IMO1233",
    "mailDeliveryBill.destinationOfficeId": "IMO1234",
    "mailDeliveryBill.destinationOfficeName": "IMO1235",
    "mailDeliveryBill.numberOfLetterPostReceptacles": "IMO1180",
    "mailDeliveryBill.numberOfParcelReceptacles": "IMO1181",
    "mailDeliveryBill.numberOfEmptyBagSacks": "IMO1182",
    "mailDeliveryBill.letterPostGrossWeightMeasure": "IMO1183",
    "mailDeliveryBill.parcelGrossWeightMeasure": "IMO1184",
    "mailDeliveryBill.emptyReceptacleGrossWeightMeasure": "IMO1185"
  },
  "mailDeliveryBill": {
    "originOfficeId": {
      "content": "KR0004"
    },
    "originOfficeName": "Origin Exchange Office 4",
    "destinationOfficeId": {
      "content": "DS0004"
    },
    "destinationOfficeName": "Destination Exchange Office 4",
    "mailCategoryCode": {
      "content": "A"
    },
    "transportEquipmentId": {
      "content": "MAILU0000004"
    },
    "sealId": {
      "content": "SEAL-00004"
    },
    "numberOfLetterPostReceptacles": 33,
    "numberOfParcelReceptacles": 13,
    "numberOfEmptyBagSacks": 7,
    "letterPostGrossWeightMeasure": {
      "content": 435.5,
      "unitCode": "KGM"
    },
    "parcelGrossWeightMeasure": {
      "content": 671.0,
      "unitCode": "KGM"
    },
    "emptyReceptacleGrossWeightMeasure": {
      "content": 38.2,
      "unitCode": "KGM"
    },
    "observations": "Synthetic UPU mail consignment sample."
  }
}