{
  "sampleMetadata": {
    "syntheticSample": true,
    "profileId": "RD24001-IMO-FAL-UNCEFACT-JSON-SAMPLE-1.0",
    "imoCompendiumVersion": "FAL.5/Circ.56",
    "datasetCode": "MAIL",
    "datasetName": "Delivery Bill for Mail Consignment",
    "datasetSlug": "delivery-bill-mail-consignment",
    "note": "Synthetic demonstration payload; not an official IMO normative JSON message."
  },
  "messageHeader": {
    "messageFunctionCode": {
      "content": "9",
      "listId": "1225",
      "listAgencyId": "UN/EDIFACT"
    },
    "authenticationDateTime": {
      "content": "2026-09-30T11:00:00Z"
    },
    "messageId": {
      "content": "MAIL-9300099-09",
      "schemeId": "RD24001-SAMPLE"
    }
  },
  "ship": {
    "imoShipNumberId": {
      "content": "9300099",
      "schemeId": "IMOShipNumber",
      "schemeAgencyId": "IMO"
    },
    "shipName": "RD GULF NAVIGATOR",
    "callSignId": {
      "content": "DR0009"
    },
    "mmsiNumberId": {
      "content": "440000009",
      "schemeId": "MMSI"
    },
    "flagStateId": {
      "content": "LR",
      "schemeId": "ISO3166-1-alpha2"
    },
    "shipTypeCode": {
      "content": "80",
      "listId": "UNECE-Rec28"
    },
    "shipTypeName": "Tanker"
  },
  "voyage": {
    "voyageId": {
      "content": "RD26-009"
    },
    "portOfDepartureCode": {
      "content": "OMSLL",
      "listId": "UNLOCODE"
    },
    "portOfDepartureName": "Salalah, Oman",
    "portOfArrivalCode": {
      "content": "AEJEA",
      "listId": "UNLOCODE"
    },
    "portOfArrivalName": "Jebel Ali, United Arab Emirates",
    "estimatedArrivalDateTime": {
      "content": "2026-09-30T11:00:00Z"
    },
    "estimatedDepartureDateTime": {
      "content": "2026-10-01T01:00:00Z"
    },
    "nextPortCode": {
      "content": "SGSIN",
      "listId": "UNLOCODE"
    },
    "nextPortName": "Singapore"
  },
  "imoDataReferences": {
    "messageHeader.messageFunctionCode": "IMO0305",
    "messageHeader.arrivalDepartureCode": "IMO0013",
    "messageHeader.authenticationDateTime": "IMO0014",
    "ship.imoShipNumberId": "IMO0140",
    "ship.shipName": "IMO0142",
    "ship.callSignId": "IMO0136",
    "ship.mmsiNumberId": "IMO0326",
    "ship.flagStateId": "IMO0138",
    "voyage.portOfArrivalCode": "IMO0108",
    "voyage.portOfArrivalName": "IMO0109",
    "voyage.estimatedArrivalDateTime": "IMO0064",
    "messageHeader.messageId": "IMO0277",
    "mailDeliveryBill.originOfficeId": "IMO1232",
    "mailDeliveryBill.originOfficeName": "IMO1233",
    "mailDeliveryBill.destinationOfficeId": "IMO1234",
    "mailDeliveryBill.destinationOfficeName": "IMO1235",
    "mailDeliveryBill.numberOfLetterPostReceptacles": "IMO1180",
    "mailDeliveryBill.numberOfParcelReceptacles": "IMO1181",
    "mailDeliveryBill.numberOfEmptyBagSacks": "IMO1182",
    "mailDeliveryBill.letterPostGrossWeightMeasure": "IMO1183",
    "mailDeliveryBill.parcelGrossWeightMeasure": "IMO1184",
    "mailDeliveryBill.emptyReceptacleGrossWeightMeasure": "IMO1185"
  },
  "mailDeliveryBill": {
    "originOfficeId": {
      "content": "KR0009"
    },
    "originOfficeName": "Origin Exchange Office 9",
    "destinationOfficeId": {
      "content": "DS0009"
    },
    "destinationOfficeName": "Destination Exchange Office 9",
    "mailCategoryCode": {
      "content": "A"
    },
    "transportEquipmentId": {
      "content": "MAILU0000009"
    },
    "sealId": {
      "content": "SEAL-00009"
    },
    "numberOfLetterPostReceptacles": 38,
    "numberOfParcelReceptacles": 18,
    "numberOfEmptyBagSacks": 12,
    "letterPostGrossWeightMeasure": {
      "content": 460.5,
      "unitCode": "KGM"
    },
    "parcelGrossWeightMeasure": {
      "content": 706.0,
      "unitCode": "KGM"
    },
    "emptyReceptacleGrossWeightMeasure": {
      "content": 43.2,
      "unitCode": "KGM"
    },
    "observations": "Synthetic UPU mail consignment sample."
  }
}