{
  "sampleMetadata": {
    "syntheticSample": true,
    "profileId": "RD24001-IMO-FAL-UNCEFACT-JSON-SAMPLE-1.0",
    "imoCompendiumVersion": "FAL.5/Circ.56",
    "datasetCode": "MAIL",
    "datasetName": "Delivery Bill for Mail Consignment",
    "datasetSlug": "delivery-bill-mail-consignment",
    "note": "Synthetic demonstration payload; not an official IMO normative JSON message."
  },
  "messageHeader": {
    "messageFunctionCode": {
      "content": "9",
      "listId": "1225",
      "listAgencyId": "UN/EDIFACT"
    },
    "authenticationDateTime": {
      "content": "2026-09-29T21:00:00Z"
    },
    "messageId": {
      "content": "MAIL-9300075-07",
      "schemeId": "RD24001-SAMPLE"
    }
  },
  "ship": {
    "imoShipNumberId": {
      "content": "9300075",
      "schemeId": "IMOShipNumber",
      "schemeAgencyId": "IMO"
    },
    "shipName": "RD AMERICA BRIDGE",
    "callSignId": {
      "content": "DR0007"
    },
    "mmsiNumberId": {
      "content": "440000007",
      "schemeId": "MMSI"
    },
    "flagStateId": {
      "content": "MH",
      "schemeId": "ISO3166-1-alpha2"
    },
    "shipTypeCode": {
      "content": "70",
      "listId": "UNECE-Rec28"
    },
    "shipTypeName": "Container ship"
  },
  "voyage": {
    "voyageId": {
      "content": "RD26-007"
    },
    "portOfDepartureCode": {
      "content": "USOAK",
      "listId": "UNLOCODE"
    },
    "portOfDepartureName": "Oakland, United States",
    "portOfArrivalCode": {
      "content": "USLAX",
      "listId": "UNLOCODE"
    },
    "portOfArrivalName": "Los Angeles, United States",
    "estimatedArrivalDateTime": {
      "content": "2026-09-29T21:00:00Z"
    },
    "estimatedDepartureDateTime": {
      "content": "2026-09-30T11:00:00Z"
    },
    "nextPortCode": {
      "content": "JPTYO",
      "listId": "UNLOCODE"
    },
    "nextPortName": "Tokyo, Japan"
  },
  "imoDataReferences": {
    "messageHeader.messageFunctionCode": "IMO0305",
    "messageHeader.arrivalDepartureCode": "IMO0013",
    "messageHeader.authenticationDateTime": "IMO0014",
    "ship.imoShipNumberId": "IMO0140",
    "ship.shipName": "IMO0142",
    "ship.callSignId": "IMO0136",
    "ship.mmsiNumberId": "IMO0326",
    "ship.flagStateId": "IMO0138",
    "voyage.portOfArrivalCode": "IMO0108",
    "voyage.portOfArrivalName": "IMO0109",
    "voyage.estimatedArrivalDateTime": "IMO0064",
    "messageHeader.messageId": "IMO0277",
    "mailDeliveryBill.originOfficeId": "IMO1232",
    "mailDeliveryBill.originOfficeName": "IMO1233",
    "mailDeliveryBill.destinationOfficeId": "IMO1234",
    "mailDeliveryBill.destinationOfficeName": "IMO1235",
    "mailDeliveryBill.numberOfLetterPostReceptacles": "IMO1180",
    "mailDeliveryBill.numberOfParcelReceptacles": "IMO1181",
    "mailDeliveryBill.numberOfEmptyBagSacks": "IMO1182",
    "mailDeliveryBill.letterPostGrossWeightMeasure": "IMO1183",
    "mailDeliveryBill.parcelGrossWeightMeasure": "IMO1184",
    "mailDeliveryBill.emptyReceptacleGrossWeightMeasure": "IMO1185"
  },
  "mailDeliveryBill": {
    "originOfficeId": {
      "content": "KR0007"
    },
    "originOfficeName": "Origin Exchange Office 7",
    "destinationOfficeId": {
      "content": "DS0007"
    },
    "destinationOfficeName": "Destination Exchange Office 7",
    "mailCategoryCode": {
      "content": "A"
    },
    "transportEquipmentId": {
      "content": "MAILU0000007"
    },
    "sealId": {
      "content": "SEAL-00007"
    },
    "numberOfLetterPostReceptacles": 36,
    "numberOfParcelReceptacles": 16,
    "numberOfEmptyBagSacks": 10,
    "letterPostGrossWeightMeasure": {
      "content": 450.5,
      "unitCode": "KGM"
    },
    "parcelGrossWeightMeasure": {
      "content": 692.0,
      "unitCode": "KGM"
    },
    "emptyReceptacleGrossWeightMeasure": {
      "content": 41.2,
      "unitCode": "KGM"
    },
    "observations": "Synthetic UPU mail consignment sample."
  }
}